,h3 filter,h2 filter,p filter,div filter,h1 filter,span filter,li filter,h3 coil,h2 coil,p coil,div coil,h1 coil,span coil,li coil,h3 fan,h2 fan,p fan,div fan,h1 fan,span fan,li fan,h3 repair,h2 repair,p repair,div repair,h1 repair,span repair,li repair,h3 maintenance,h2 maintenance,p maintenance,div maintenance,h1 maintenance,span maintenance,li maintenance
0,,Clean The PTAC Filters Monthly,"As you maintain your PTAC, don’t just focus on the filter. Be sure to include the fans and drain passages, as these are some of the most vital parts that need a thorough cleaning.",,,,Remove the PTAC filters;,,,,,,,,,,"As you maintain your PTAC, don’t just focus on the filter. Be sure to include the fans and drain passages, as these are some of the most vital parts that need a thorough cleaning.",,,,,,,Don’t rely only on your memory as to what repairs have been done. Keeping a log doesn’t just ensure you’re up-to-date with the PTAC’s maintenance.,,,,,Why Pre-Summer HVAC Maintenance is a Worthy Investment,Keep A PTAC Maintenance Log,"With that said, here are some of the best PTAC maintenance tips so you can extend your unit’s lifespan:",,5 PTAC Maintenance Tips To Extend Your Unit’s Lifespan,Why Pre-Summer HVAC Maintenance is a Worthy Investment,
1,,,"While the maintenance of the unit can be done through an annual check, the filters should be cleaned monthly to ensure that clean air is blown in the room. The last thing you’ll want is for the room to be dirty, not because it wasn’t cleaned but because of the PTAC unit.",,,,Vacuum the dust accumulated on the PTAC filter;,,,,,,,,,,,,,,,,,,,,,,Why Pre-Summer HVAC Maintenance is a Worthy Investment,,"While the maintenance of the unit can be done through an annual check, the filters should be cleaned monthly to ensure that clean air is blown in the room. The last thing you’ll want is for the room to be dirty, not because it wasn’t cleaned but because of the PTAC unit.",,,,
2,,,Here’s how to clean the filter:,,,,Throw any damaged filter;,,,,,,,,,,,,,,,,,,,,,,,,Don’t rely only on your memory as to what repairs have been done. Keeping a log doesn’t just ensure you’re up-to-date with the PTAC’s maintenance.,,,,
3,,,,,,,Clean the filters under running water;,,,,,,,,,,,,,,,,,,,,,,,,The maintenance log enables easy tracking of air conditioner problems and proper monitoring.,,,,
4,,,,,,,Return the clean filters to the PTAC unit.,,,,,,,,,,,,,,,,,,,,,,,,,,,,
